No.     Time           Source                Destination           Protocol Length Info
      1 0.000000000    Parallel_53:32:ac     Broadcast             ARP      42     Who has 10.211.55.1?  Tell 10.211.55.3

Frame 1: 42 bytes on wire (336 bits), 42 bytes captured (336 bits) on interface 0
Ethernet II, Src: Parallel_53:32:ac (00:1c:42:53:32:ac), Dst: Broadcast (ff:ff:ff:ff:ff:ff)
Address Resolution Protocol (request)

No.     Time           Source                Destination           Protocol Length Info
      2 0.000141000    Parallel_00:00:18     Parallel_53:32:ac     ARP      42     10.211.55.1 is at 00:1c:42:00:00:18

Frame 2: 42 bytes on wire (336 bits), 42 bytes captured (336 bits) on interface 0
Ethernet II, Src: Parallel_00:00:18 (00:1c:42:00:00:18), Dst: Parallel_53:32:ac (00:1c:42:53:32:ac)
Address Resolution Protocol (reply)

No.     Time           Source                Destination           Protocol Length Info
      3 0.000148000    10.211.55.3           10.211.55.1           DNS      70     Standard query 0xde94  A google.com

Frame 3: 70 bytes on wire (560 bits), 70 bytes captured (560 bits) on interface 0
Ethernet II, Src: Parallel_53:32:ac (00:1c:42:53:32:ac), Dst: Parallel_00:00:18 (00:1c:42:00:00:18)
Internet Protocol Version 4, Src: 10.211.55.3 (10.211.55.3), Dst: 10.211.55.1 (10.211.55.1)
User Datagram Protocol, Src Port: 47906 (47906), Dst Port: domain (53)
Domain Name System (query)

No.     Time           Source                Destination           Protocol Length Info
      4 0.068161000    10.211.55.1           10.211.55.3           DNS      326    Standard query response 0xde94  A 4.53.56.109 A 4.53.56.108 A 4.53.56.104 A 4.53.56.103 A 4.53.56.99 A 4.53.56.98 A 4.53.56.94 A 4.53.56.93 A 4.53.56.89 A 4.53.56.88 A 4.53.56.84 A 4.53.56.123 A 4.53.56.119 A 4.53.56.118 A 4.53.56.114 A 4.53.56.113

Frame 4: 326 bytes on wire (2608 bits), 326 bytes captured (2608 bits) on interface 0
Ethernet II, Src: Parallel_00:00:18 (00:1c:42:00:00:18), Dst: Parallel_53:32:ac (00:1c:42:53:32:ac)
Internet Protocol Version 4, Src: 10.211.55.1 (10.211.55.1), Dst: 10.211.55.3 (10.211.55.3)
User Datagram Protocol, Src Port: domain (53), Dst Port: 47906 (47906)
Domain Name System (response)

No.     Time           Source                Destination           Protocol Length Info
      5 0.068575000    10.211.55.3           4.53.56.109           TCP      74     42461 > http [SYN] Seq=0 Win=14600 Len=0 MSS=1460 SACK_PERM=1 TSval=310193 TSecr=0 WS=128

Frame 5: 74 bytes on wire (592 bits), 74 bytes captured (592 bits) on interface 0
Ethernet II, Src: Parallel_53:32:ac (00:1c:42:53:32:ac), Dst: Parallel_00:00:18 (00:1c:42:00:00:18)
Internet Protocol Version 4, Src: 10.211.55.3 (10.211.55.3), Dst: 4.53.56.109 (4.53.56.109)
Transmission Control Protocol, Src Port: 42461 (42461), Dst Port: http (80), Seq: 0, Len: 0

No.     Time           Source                Destination           Protocol Length Info
      6 0.074724000    4.53.56.109           10.211.55.3           TCP      62     http > 42461 [SYN, ACK] Seq=0 Ack=1 Win=32768 Len=0 MSS=1460 WS=2

Frame 6: 62 bytes on wire (496 bits), 62 bytes captured (496 bits) on interface 0
Ethernet II, Src: Parallel_00:00:18 (00:1c:42:00:00:18), Dst: Parallel_53:32:ac (00:1c:42:53:32:ac)
Internet Protocol Version 4, Src: 4.53.56.109 (4.53.56.109), Dst: 10.211.55.3 (10.211.55.3)
Transmission Control Protocol, Src Port: http (80), Dst Port: 42461 (42461), Seq: 0, Ack: 1, Len: 0

No.     Time           Source                Destination           Protocol Length Info
      7 0.074762000    10.211.55.3           4.53.56.109           TCP      54     42461 > http [ACK] Seq=1 Ack=1 Win=14720 Len=0

Frame 7: 54 bytes on wire (432 bits), 54 bytes captured (432 bits) on interface 0
Ethernet II, Src: Parallel_53:32:ac (00:1c:42:53:32:ac), Dst: Parallel_00:00:18 (00:1c:42:00:00:18)
Internet Protocol Version 4, Src: 10.211.55.3 (10.211.55.3), Dst: 4.53.56.109 (4.53.56.109)
Transmission Control Protocol, Src Port: 42461 (42461), Dst Port: http (80), Seq: 1, Ack: 1, Len: 0

No.     Time           Source                Destination           Protocol Length Info
      8 0.074958000    10.211.55.3           4.53.56.109           HTTP     423    GET / HTTP/1.1 

Frame 8: 423 bytes on wire (3384 bits), 423 bytes captured (3384 bits) on interface 0
Ethernet II, Src: Parallel_53:32:ac (00:1c:42:53:32:ac), Dst: Parallel_00:00:18 (00:1c:42:00:00:18)
Internet Protocol Version 4, Src: 10.211.55.3 (10.211.55.3), Dst: 4.53.56.109 (4.53.56.109)
Transmission Control Protocol, Src Port: 42461 (42461), Dst Port: http (80), Seq: 1, Ack: 1, Len: 369
Hypertext Transfer Protocol

No.     Time           Source                Destination           Protocol Length Info
      9 0.075474000    4.53.56.109           10.211.55.3           TCP      54     http > 42461 [ACK] Seq=1 Ack=370 Win=32768 Len=0

Frame 9: 54 bytes on wire (432 bits), 54 bytes captured (432 bits) on interface 0
Ethernet II, Src: Parallel_00:00:18 (00:1c:42:00:00:18), Dst: Parallel_53:32:ac (00:1c:42:53:32:ac)
Internet Protocol Version 4, Src: 4.53.56.109 (4.53.56.109), Dst: 10.211.55.3 (10.211.55.3)
Transmission Control Protocol, Src Port: http (80), Dst Port: 42461 (42461), Seq: 1, Ack: 370, Len: 0

No.     Time           Source                Destination           Protocol Length Info
     10 0.104701000    4.53.56.109           10.211.55.3           HTTP     594    HTTP/1.1 301 Moved Permanently  (text/html)

Frame 10: 594 bytes on wire (4752 bits), 594 bytes captured (4752 bits) on interface 0
Ethernet II, Src: Parallel_00:00:18 (00:1c:42:00:00:18), Dst: Parallel_53:32:ac (00:1c:42:53:32:ac)
Internet Protocol Version 4, Src: 4.53.56.109 (4.53.56.109), Dst: 10.211.55.3 (10.211.55.3)
Transmission Control Protocol, Src Port: http (80), Dst Port: 42461 (42461), Seq: 1, Ack: 370, Len: 540
Hypertext Transfer Protocol
Line-based text data: text/html

No.     Time           Source                Destination           Protocol Length Info
     11 0.104741000    10.211.55.3           4.53.56.109           TCP      54     42461 > http [ACK] Seq=370 Ack=541 Win=15744 Len=0

Frame 11: 54 bytes on wire (432 bits), 54 bytes captured (432 bits) on interface 0
Ethernet II, Src: Parallel_53:32:ac (00:1c:42:53:32:ac), Dst: Parallel_00:00:18 (00:1c:42:00:00:18)
Internet Protocol Version 4, Src: 10.211.55.3 (10.211.55.3), Dst: 4.53.56.109 (4.53.56.109)
Transmission Control Protocol, Src Port: 42461 (42461), Dst Port: http (80), Seq: 370, Ack: 541, Len: 0

No.     Time           Source                Destination           Protocol Length Info
     12 0.118402000    10.211.55.3           74.125.235.51         TCP      74     43195 > http [SYN] Seq=0 Win=14600 Len=0 MSS=1460 SACK_PERM=1 TSval=310205 TSecr=0 WS=128

Frame 12: 74 bytes on wire (592 bits), 74 bytes captured (592 bits) on interface 0
Ethernet II, Src: Parallel_53:32:ac (00:1c:42:53:32:ac), Dst: Parallel_00:00:18 (00:1c:42:00:00:18)
Internet Protocol Version 4, Src: 10.211.55.3 (10.211.55.3), Dst: 74.125.235.51 (74.125.235.51)
Transmission Control Protocol, Src Port: 43195 (43195), Dst Port: http (80), Seq: 0, Len: 0

No.     Time           Source                Destination           Protocol Length Info
     13 0.315684000    74.125.235.51         10.211.55.3           TCP      62     http > 43195 [SYN, ACK] Seq=0 Ack=1 Win=32768 Len=0 MSS=1460 WS=2

Frame 13: 62 bytes on wire (496 bits), 62 bytes captured (496 bits) on interface 0
Ethernet II, Src: Parallel_00:00:18 (00:1c:42:00:00:18), Dst: Parallel_53:32:ac (00:1c:42:53:32:ac)
Internet Protocol Version 4, Src: 74.125.235.51 (74.125.235.51), Dst: 10.211.55.3 (10.211.55.3)
Transmission Control Protocol, Src Port: http (80), Dst Port: 43195 (43195), Seq: 0, Ack: 1, Len: 0

No.     Time           Source                Destination           Protocol Length Info
     14 0.316127000    10.211.55.3           74.125.235.51         TCP      54     43195 > http [ACK] Seq=1 Ack=1 Win=14720 Len=0

Frame 14: 54 bytes on wire (432 bits), 54 bytes captured (432 bits) on interface 0
Ethernet II, Src: Parallel_53:32:ac (00:1c:42:53:32:ac), Dst: Parallel_00:00:18 (00:1c:42:00:00:18)
Internet Protocol Version 4, Src: 10.211.55.3 (10.211.55.3), Dst: 74.125.235.51 (74.125.235.51)
Transmission Control Protocol, Src Port: 43195 (43195), Dst Port: http (80), Seq: 1, Ack: 1, Len: 0

No.     Time           Source                Destination           Protocol Length Info
     15 0.316367000    10.211.55.3           74.125.235.51         HTTP     427    GET / HTTP/1.1 

Frame 15: 427 bytes on wire (3416 bits), 427 bytes captured (3416 bits) on interface 0
Ethernet II, Src: Parallel_53:32:ac (00:1c:42:53:32:ac), Dst: Parallel_00:00:18 (00:1c:42:00:00:18)
Internet Protocol Version 4, Src: 10.211.55.3 (10.211.55.3), Dst: 74.125.235.51 (74.125.235.51)
Transmission Control Protocol, Src Port: 43195 (43195), Dst Port: http (80), Seq: 1, Ack: 1, Len: 373
Hypertext Transfer Protocol

No.     Time           Source                Destination           Protocol Length Info
     16 0.316513000    74.125.235.51         10.211.55.3           TCP      54     http > 43195 [ACK] Seq=1 Ack=374 Win=32768 Len=0

Frame 16: 54 bytes on wire (432 bits), 54 bytes captured (432 bits) on interface 0
Ethernet II, Src: Parallel_00:00:18 (00:1c:42:00:00:18), Dst: Parallel_53:32:ac (00:1c:42:53:32:ac)
Internet Protocol Version 4, Src: 74.125.235.51 (74.125.235.51), Dst: 10.211.55.3 (10.211.55.3)
Transmission Control Protocol, Src Port: http (80), Dst Port: 43195 (43195), Seq: 1, Ack: 374, Len: 0

No.     Time           Source                Destination           Protocol Length Info
     17 0.556550000    74.125.235.51         10.211.55.3           TCP      1440   [TCP segment of a reassembled PDU]

Frame 17: 1440 bytes on wire (11520 bits), 1440 bytes captured (11520 bits) on interface 0
Ethernet II, Src: Parallel_00:00:18 (00:1c:42:00:00:18), Dst: Parallel_53:32:ac (00:1c:42:53:32:ac)
Internet Protocol Version 4, Src: 74.125.235.51 (74.125.235.51), Dst: 10.211.55.3 (10.211.55.3)
Transmission Control Protocol, Src Port: http (80), Dst Port: 43195 (43195), Seq: 1, Ack: 374, Len: 1386

No.     Time           Source                Destination           Protocol Length Info
     18 0.556618000    10.211.55.3           74.125.235.51         TCP      54     43195 > http [ACK] Seq=374 Ack=1387 Win=17536 Len=0

Frame 18: 54 bytes on wire (432 bits), 54 bytes captured (432 bits) on interface 0
Ethernet II, Src: Parallel_53:32:ac (00:1c:42:53:32:ac), Dst: Parallel_00:00:18 (00:1c:42:00:00:18)
Internet Protocol Version 4, Src: 10.211.55.3 (10.211.55.3), Dst: 74.125.235.51 (74.125.235.51)
Transmission Control Protocol, Src Port: 43195 (43195), Dst Port: http (80), Seq: 374, Ack: 1387, Len: 0

No.     Time           Source                Destination           Protocol Length Info
     19 0.556770000    74.125.235.51         10.211.55.3           TCP      1440   [TCP segment of a reassembled PDU]

Frame 19: 1440 bytes on wire (11520 bits), 1440 bytes captured (11520 bits) on interface 0
Ethernet II, Src: Parallel_00:00:18 (00:1c:42:00:00:18), Dst: Parallel_53:32:ac (00:1c:42:53:32:ac)
Internet Protocol Version 4, Src: 74.125.235.51 (74.125.235.51), Dst: 10.211.55.3 (10.211.55.3)
Transmission Control Protocol, Src Port: http (80), Dst Port: 43195 (43195), Seq: 1387, Ack: 374, Len: 1386

No.     Time           Source                Destination           Protocol Length Info
     20 0.556800000    10.211.55.3           74.125.235.51         TCP      54     43195 > http [ACK] Seq=374 Ack=2773 Win=20480 Len=0

Frame 20: 54 bytes on wire (432 bits), 54 bytes captured (432 bits) on interface 0
Ethernet II, Src: Parallel_53:32:ac (00:1c:42:53:32:ac), Dst: Parallel_00:00:18 (00:1c:42:00:00:18)
Internet Protocol Version 4, Src: 10.211.55.3 (10.211.55.3), Dst: 74.125.235.51 (74.125.235.51)
Transmission Control Protocol, Src Port: 43195 (43195), Dst Port: http (80), Seq: 374, Ack: 2773, Len: 0

No.     Time           Source                Destination           Protocol Length Info
     21 0.557740000    74.125.235.51         10.211.55.3           TCP      1514   [TCP segment of a reassembled PDU]

Frame 21: 1514 bytes on wire (12112 bits), 1514 bytes captured (12112 bits) on interface 0
Ethernet II, Src: Parallel_00:00:18 (00:1c:42:00:00:18), Dst: Parallel_53:32:ac (00:1c:42:53:32:ac)
Internet Protocol Version 4, Src: 74.125.235.51 (74.125.235.51), Dst: 10.211.55.3 (10.211.55.3)
Transmission Control Protocol, Src Port: http (80), Dst Port: 43195 (43195), Seq: 2773, Ack: 374, Len: 1460

No.     Time           Source                Destination           Protocol Length Info
     22 0.557804000    10.211.55.3           74.125.235.51         TCP      54     43195 > http [ACK] Seq=374 Ack=4233 Win=23424 Len=0

Frame 22: 54 bytes on wire (432 bits), 54 bytes captured (432 bits) on interface 0
Ethernet II, Src: Parallel_53:32:ac (00:1c:42:53:32:ac), Dst: Parallel_00:00:18 (00:1c:42:00:00:18)
Internet Protocol Version 4, Src: 10.211.55.3 (10.211.55.3), Dst: 74.125.235.51 (74.125.235.51)
Transmission Control Protocol, Src Port: 43195 (43195), Dst Port: http (80), Seq: 374, Ack: 4233, Len: 0

No.     Time           Source                Destination           Protocol Length Info
     23 0.557856000    74.125.235.51         10.211.55.3           TCP      1514   [TCP segment of a reassembled PDU]

Frame 23: 1514 bytes on wire (12112 bits), 1514 bytes captured (12112 bits) on interface 0
Ethernet II, Src: Parallel_00:00:18 (00:1c:42:00:00:18), Dst: Parallel_53:32:ac (00:1c:42:53:32:ac)
Internet Protocol Version 4, Src: 74.125.235.51 (74.125.235.51), Dst: 10.211.55.3 (10.211.55.3)
Transmission Control Protocol, Src Port: http (80), Dst Port: 43195 (43195), Seq: 4233, Ack: 374, Len: 1460

No.     Time           Source                Destination           Protocol Length Info
     24 0.557881000    10.211.55.3           74.125.235.51         TCP      54     43195 > http [ACK] Seq=374 Ack=5693 Win=26368 Len=0

Frame 24: 54 bytes on wire (432 bits), 54 bytes captured (432 bits) on interface 0
Ethernet II, Src: Parallel_53:32:ac (00:1c:42:53:32:ac), Dst: Parallel_00:00:18 (00:1c:42:00:00:18)
Internet Protocol Version 4, Src: 10.211.55.3 (10.211.55.3), Dst: 74.125.235.51 (74.125.235.51)
Transmission Control Protocol, Src Port: 43195 (43195), Dst Port: http (80), Seq: 374, Ack: 5693, Len: 0

No.     Time           Source                Destination           Protocol Length Info
     25 0.557887000    74.125.235.51         10.211.55.3           TCP      1514   [TCP segment of a reassembled PDU]

Frame 25: 1514 bytes on wire (12112 bits), 1514 bytes captured (12112 bits) on interface 0
Ethernet II, Src: Parallel_00:00:18 (00:1c:42:00:00:18), Dst: Parallel_53:32:ac (00:1c:42:53:32:ac)
Internet Protocol Version 4, Src: 74.125.235.51 (74.125.235.51), Dst: 10.211.55.3 (10.211.55.3)
Transmission Control Protocol, Src Port: http (80), Dst Port: 43195 (43195), Seq: 5693, Ack: 374, Len: 1460

No.     Time           Source                Destination           Protocol Length Info
     26 0.557893000    10.211.55.3           74.125.235.51         TCP      54     43195 > http [ACK] Seq=374 Ack=7153 Win=29312 Len=0

Frame 26: 54 bytes on wire (432 bits), 54 bytes captured (432 bits) on interface 0
Ethernet II, Src: Parallel_53:32:ac (00:1c:42:53:32:ac), Dst: Parallel_00:00:18 (00:1c:42:00:00:18)
Internet Protocol Version 4, Src: 10.211.55.3 (10.211.55.3), Dst: 74.125.235.51 (74.125.235.51)
Transmission Control Protocol, Src Port: 43195 (43195), Dst Port: http (80), Seq: 374, Ack: 7153, Len: 0

No.     Time           Source                Destination           Protocol Length Info
     27 0.557896000    74.125.235.51         10.211.55.3           TCP      1218   [TCP segment of a reassembled PDU]

Frame 27: 1218 bytes on wire (9744 bits), 1218 bytes captured (9744 bits) on interface 0
Ethernet II, Src: Parallel_00:00:18 (00:1c:42:00:00:18), Dst: Parallel_53:32:ac (00:1c:42:53:32:ac)
Internet Protocol Version 4, Src: 74.125.235.51 (74.125.235.51), Dst: 10.211.55.3 (10.211.55.3)
Transmission Control Protocol, Src Port: http (80), Dst Port: 43195 (43195), Seq: 7153, Ack: 374, Len: 1164

No.     Time           Source                Destination           Protocol Length Info
     28 0.557902000    10.211.55.3           74.125.235.51         TCP      54     43195 > http [ACK] Seq=374 Ack=8317 Win=32128 Len=0

Frame 28: 54 bytes on wire (432 bits), 54 bytes captured (432 bits) on interface 0
Ethernet II, Src: Parallel_53:32:ac (00:1c:42:53:32:ac), Dst: Parallel_00:00:18 (00:1c:42:00:00:18)
Internet Protocol Version 4, Src: 10.211.55.3 (10.211.55.3), Dst: 74.125.235.51 (74.125.235.51)
Transmission Control Protocol, Src Port: 43195 (43195), Dst Port: http (80), Seq: 374, Ack: 8317, Len: 0

No.     Time           Source                Destination           Protocol Length Info
     29 0.557964000    74.125.235.51         10.211.55.3           TCP      1514   [TCP segment of a reassembled PDU]

Frame 29: 1514 bytes on wire (12112 bits), 1514 bytes captured (12112 bits) on interface 0
Ethernet II, Src: Parallel_00:00:18 (00:1c:42:00:00:18), Dst: Parallel_53:32:ac (00:1c:42:53:32:ac)
Internet Protocol Version 4, Src: 74.125.235.51 (74.125.235.51), Dst: 10.211.55.3 (10.211.55.3)
Transmission Control Protocol, Src Port: http (80), Dst Port: 43195 (43195), Seq: 8317, Ack: 374, Len: 1460

No.     Time           Source                Destination           Protocol Length Info
     30 0.557972000    10.211.55.3           74.125.235.51         TCP      54     43195 > http [ACK] Seq=374 Ack=9777 Win=35072 Len=0

Frame 30: 54 bytes on wire (432 bits), 54 bytes captured (432 bits) on interface 0
Ethernet II, Src: Parallel_53:32:ac (00:1c:42:53:32:ac), Dst: Parallel_00:00:18 (00:1c:42:00:00:18)
Internet Protocol Version 4, Src: 10.211.55.3 (10.211.55.3), Dst: 74.125.235.51 (74.125.235.51)
Transmission Control Protocol, Src Port: 43195 (43195), Dst Port: http (80), Seq: 374, Ack: 9777, Len: 0

No.     Time           Source                Destination           Protocol Length Info
     31 0.558005000    74.125.235.51         10.211.55.3           TCP      1366   [TCP segment of a reassembled PDU]

Frame 31: 1366 bytes on wire (10928 bits), 1366 bytes captured (10928 bits) on interface 0
Ethernet II, Src: Parallel_00:00:18 (00:1c:42:00:00:18), Dst: Parallel_53:32:ac (00:1c:42:53:32:ac)
Internet Protocol Version 4, Src: 74.125.235.51 (74.125.235.51), Dst: 10.211.55.3 (10.211.55.3)
Transmission Control Protocol, Src Port: http (80), Dst Port: 43195 (43195), Seq: 9777, Ack: 374, Len: 1312

No.     Time           Source                Destination           Protocol Length Info
     32 0.558012000    10.211.55.3           74.125.235.51         TCP      54     43195 > http [ACK] Seq=374 Ack=11089 Win=35968 Len=0

Frame 32: 54 bytes on wire (432 bits), 54 bytes captured (432 bits) on interface 0
Ethernet II, Src: Parallel_53:32:ac (00:1c:42:53:32:ac), Dst: Parallel_00:00:18 (00:1c:42:00:00:18)
Internet Protocol Version 4, Src: 10.211.55.3 (10.211.55.3), Dst: 74.125.235.51 (74.125.235.51)
Transmission Control Protocol, Src Port: 43195 (43195), Dst Port: http (80), Seq: 374, Ack: 11089, Len: 0

No.     Time           Source                Destination           Protocol Length Info
     33 0.558399000    74.125.235.51         10.211.55.3           TCP      1440   [TCP segment of a reassembled PDU]

Frame 33: 1440 bytes on wire (11520 bits), 1440 bytes captured (11520 bits) on interface 0
Ethernet II, Src: Parallel_00:00:18 (00:1c:42:00:00:18), Dst: Parallel_53:32:ac (00:1c:42:53:32:ac)
Internet Protocol Version 4, Src: 74.125.235.51 (74.125.235.51), Dst: 10.211.55.3 (10.211.55.3)
Transmission Control Protocol, Src Port: http (80), Dst Port: 43195 (43195), Seq: 11089, Ack: 374, Len: 1386

No.     Time           Source                Destination           Protocol Length Info
     34 0.558411000    10.211.55.3           74.125.235.51         TCP      54     43195 > http [ACK] Seq=374 Ack=12475 Win=34944 Len=0

Frame 34: 54 bytes on wire (432 bits), 54 bytes captured (432 bits) on interface 0
Ethernet II, Src: Parallel_53:32:ac (00:1c:42:53:32:ac), Dst: Parallel_00:00:18 (00:1c:42:00:00:18)
Internet Protocol Version 4, Src: 10.211.55.3 (10.211.55.3), Dst: 74.125.235.51 (74.125.235.51)
Transmission Control Protocol, Src Port: 43195 (43195), Dst Port: http (80), Seq: 374, Ack: 12475, Len: 0

No.     Time           Source                Destination           Protocol Length Info
     35 0.558500000    74.125.235.51         10.211.55.3           TCP      1440   [TCP segment of a reassembled PDU]

Frame 35: 1440 bytes on wire (11520 bits), 1440 bytes captured (11520 bits) on interface 0
Ethernet II, Src: Parallel_00:00:18 (00:1c:42:00:00:18), Dst: Parallel_53:32:ac (00:1c:42:53:32:ac)
Internet Protocol Version 4, Src: 74.125.235.51 (74.125.235.51), Dst: 10.211.55.3 (10.211.55.3)
Transmission Control Protocol, Src Port: http (80), Dst Port: 43195 (43195), Seq: 12475, Ack: 374, Len: 1386

No.     Time           Source                Destination           Protocol Length Info
     36 0.558510000    10.211.55.3           74.125.235.51         TCP      54     43195 > http [ACK] Seq=374 Ack=13861 Win=34048 Len=0

Frame 36: 54 bytes on wire (432 bits), 54 bytes captured (432 bits) on interface 0
Ethernet II, Src: Parallel_53:32:ac (00:1c:42:53:32:ac), Dst: Parallel_00:00:18 (00:1c:42:00:00:18)
Internet Protocol Version 4, Src: 10.211.55.3 (10.211.55.3), Dst: 74.125.235.51 (74.125.235.51)
Transmission Control Protocol, Src Port: 43195 (43195), Dst Port: http (80), Seq: 374, Ack: 13861, Len: 0

No.     Time           Source                Destination           Protocol Length Info
     37 0.755042000    74.125.235.51         10.211.55.3           TCP      1514   [TCP segment of a reassembled PDU]

Frame 37: 1514 bytes on wire (12112 bits), 1514 bytes captured (12112 bits) on interface 0
Ethernet II, Src: Parallel_00:00:18 (00:1c:42:00:00:18), Dst: Parallel_53:32:ac (00:1c:42:53:32:ac)
Internet Protocol Version 4, Src: 74.125.235.51 (74.125.235.51), Dst: 10.211.55.3 (10.211.55.3)
Transmission Control Protocol, Src Port: http (80), Dst Port: 43195 (43195), Seq: 13861, Ack: 374, Len: 1460

No.     Time           Source                Destination           Protocol Length Info
     38 0.755101000    10.211.55.3           74.125.235.51         TCP      54     43195 > http [ACK] Seq=374 Ack=15321 Win=40960 Len=0

Frame 38: 54 bytes on wire (432 bits), 54 bytes captured (432 bits) on interface 0
Ethernet II, Src: Parallel_53:32:ac (00:1c:42:53:32:ac), Dst: Parallel_00:00:18 (00:1c:42:00:00:18)
Internet Protocol Version 4, Src: 10.211.55.3 (10.211.55.3), Dst: 74.125.235.51 (74.125.235.51)
Transmission Control Protocol, Src Port: 43195 (43195), Dst Port: http (80), Seq: 374, Ack: 15321, Len: 0

No.     Time           Source                Destination           Protocol Length Info
     39 0.755168000    74.125.235.51         10.211.55.3           TCP      1366   [TCP segment of a reassembled PDU]

Frame 39: 1366 bytes on wire (10928 bits), 1366 bytes captured (10928 bits) on interface 0
Ethernet II, Src: Parallel_00:00:18 (00:1c:42:00:00:18), Dst: Parallel_53:32:ac (00:1c:42:53:32:ac)
Internet Protocol Version 4, Src: 74.125.235.51 (74.125.235.51), Dst: 10.211.55.3 (10.211.55.3)
Transmission Control Protocol, Src Port: http (80), Dst Port: 43195 (43195), Seq: 15321, Ack: 374, Len: 1312

No.     Time           Source                Destination           Protocol Length Info
     40 0.755180000    10.211.55.3           74.125.235.51         TCP      54     43195 > http [ACK] Seq=374 Ack=16633 Win=41728 Len=0

Frame 40: 54 bytes on wire (432 bits), 54 bytes captured (432 bits) on interface 0
Ethernet II, Src: Parallel_53:32:ac (00:1c:42:53:32:ac), Dst: Parallel_00:00:18 (00:1c:42:00:00:18)
Internet Protocol Version 4, Src: 10.211.55.3 (10.211.55.3), Dst: 74.125.235.51 (74.125.235.51)
Transmission Control Protocol, Src Port: 43195 (43195), Dst Port: http (80), Seq: 374, Ack: 16633, Len: 0

No.     Time           Source                Destination           Protocol Length Info
     41 0.755189000    74.125.235.51         10.211.55.3           TCP      1514   [TCP segment of a reassembled PDU]

Frame 41: 1514 bytes on wire (12112 bits), 1514 bytes captured (12112 bits) on interface 0
Ethernet II, Src: Parallel_00:00:18 (00:1c:42:00:00:18), Dst: Parallel_53:32:ac (00:1c:42:53:32:ac)
Internet Protocol Version 4, Src: 74.125.235.51 (74.125.235.51), Dst: 10.211.55.3 (10.211.55.3)
Transmission Control Protocol, Src Port: http (80), Dst Port: 43195 (43195), Seq: 16633, Ack: 374, Len: 1460

No.     Time           Source                Destination           Protocol Length Info
     42 0.755194000    10.211.55.3           74.125.235.51         TCP      54     43195 > http [ACK] Seq=374 Ack=18093 Win=40704 Len=0

Frame 42: 54 bytes on wire (432 bits), 54 bytes captured (432 bits) on interface 0
Ethernet II, Src: Parallel_53:32:ac (00:1c:42:53:32:ac), Dst: Parallel_00:00:18 (00:1c:42:00:00:18)
Internet Protocol Version 4, Src: 10.211.55.3 (10.211.55.3), Dst: 74.125.235.51 (74.125.235.51)
Transmission Control Protocol, Src Port: 43195 (43195), Dst Port: http (80), Seq: 374, Ack: 18093, Len: 0

No.     Time           Source                Destination           Protocol Length Info
     43 0.755199000    74.125.235.51         10.211.55.3           HTTP     1366   Continuation or non-HTTP traffic

Frame 43: 1366 bytes on wire (10928 bits), 1366 bytes captured (10928 bits) on interface 0
Ethernet II, Src: Parallel_00:00:18 (00:1c:42:00:00:18), Dst: Parallel_53:32:ac (00:1c:42:53:32:ac)
Internet Protocol Version 4, Src: 74.125.235.51 (74.125.235.51), Dst: 10.211.55.3 (10.211.55.3)
Transmission Control Protocol, Src Port: http (80), Dst Port: 43195 (43195), Seq: 18093, Ack: 374, Len: 1312
Hypertext Transfer Protocol

No.     Time           Source                Destination           Protocol Length Info
     44 0.755203000    10.211.55.3           74.125.235.51         TCP      54     43195 > http [ACK] Seq=374 Ack=19405 Win=39808 Len=0

Frame 44: 54 bytes on wire (432 bits), 54 bytes captured (432 bits) on interface 0
Ethernet II, Src: Parallel_53:32:ac (00:1c:42:53:32:ac), Dst: Parallel_00:00:18 (00:1c:42:00:00:18)
Internet Protocol Version 4, Src: 10.211.55.3 (10.211.55.3), Dst: 74.125.235.51 (74.125.235.51)
Transmission Control Protocol, Src Port: 43195 (43195), Dst Port: http (80), Seq: 374, Ack: 19405, Len: 0

No.     Time           Source                Destination           Protocol Length Info
     45 0.755592000    74.125.235.51         10.211.55.3           HTTP     1440   Continuation or non-HTTP traffic

Frame 45: 1440 bytes on wire (11520 bits), 1440 bytes captured (11520 bits) on interface 0
Ethernet II, Src: Parallel_00:00:18 (00:1c:42:00:00:18), Dst: Parallel_53:32:ac (00:1c:42:53:32:ac)
Internet Protocol Version 4, Src: 74.125.235.51 (74.125.235.51), Dst: 10.211.55.3 (10.211.55.3)
Transmission Control Protocol, Src Port: http (80), Dst Port: 43195 (43195), Seq: 19405, Ack: 374, Len: 1386
Hypertext Transfer Protocol

No.     Time           Source                Destination           Protocol Length Info
     46 0.755611000    74.125.235.51         10.211.55.3           HTTP     1440   Continuation or non-HTTP traffic

Frame 46: 1440 bytes on wire (11520 bits), 1440 bytes captured (11520 bits) on interface 0
Ethernet II, Src: Parallel_00:00:18 (00:1c:42:00:00:18), Dst: Parallel_53:32:ac (00:1c:42:53:32:ac)
Internet Protocol Version 4, Src: 74.125.235.51 (74.125.235.51), Dst: 10.211.55.3 (10.211.55.3)
Transmission Control Protocol, Src Port: http (80), Dst Port: 43195 (43195), Seq: 20791, Ack: 374, Len: 1386
Hypertext Transfer Protocol

No.     Time           Source                Destination           Protocol Length Info
     47 0.755616000    10.211.55.3           74.125.235.51         TCP      54     43195 > http [ACK] Seq=374 Ack=22177 Win=41728 Len=0

Frame 47: 54 bytes on wire (432 bits), 54 bytes captured (432 bits) on interface 0
Ethernet II, Src: Parallel_53:32:ac (00:1c:42:53:32:ac), Dst: Parallel_00:00:18 (00:1c:42:00:00:18)
Internet Protocol Version 4, Src: 10.211.55.3 (10.211.55.3), Dst: 74.125.235.51 (74.125.235.51)
Transmission Control Protocol, Src Port: 43195 (43195), Dst Port: http (80), Seq: 374, Ack: 22177, Len: 0

No.     Time           Source                Destination           Protocol Length Info
     48 0.756249000    74.125.235.51         10.211.55.3           HTTP     1440   Continuation or non-HTTP traffic

Frame 48: 1440 bytes on wire (11520 bits), 1440 bytes captured (11520 bits) on interface 0
Ethernet II, Src: Parallel_00:00:18 (00:1c:42:00:00:18), Dst: Parallel_53:32:ac (00:1c:42:53:32:ac)
Internet Protocol Version 4, Src: 74.125.235.51 (74.125.235.51), Dst: 10.211.55.3 (10.211.55.3)
Transmission Control Protocol, Src Port: http (80), Dst Port: 43195 (43195), Seq: 22177, Ack: 374, Len: 1386
Hypertext Transfer Protocol

No.     Time           Source                Destination           Protocol Length Info
     49 0.756258000    74.125.235.51         10.211.55.3           HTTP     1440   Continuation or non-HTTP traffic

Frame 49: 1440 bytes on wire (11520 bits), 1440 bytes captured (11520 bits) on interface 0
Ethernet II, Src: Parallel_00:00:18 (00:1c:42:00:00:18), Dst: Parallel_53:32:ac (00:1c:42:53:32:ac)
Internet Protocol Version 4, Src: 74.125.235.51 (74.125.235.51), Dst: 10.211.55.3 (10.211.55.3)
Transmission Control Protocol, Src Port: http (80), Dst Port: 43195 (43195), Seq: 23563, Ack: 374, Len: 1386
Hypertext Transfer Protocol

No.     Time           Source                Destination           Protocol Length Info
     50 0.756262000    10.211.55.3           74.125.235.51         TCP      54     43195 > http [ACK] Seq=374 Ack=24949 Win=41728 Len=0

Frame 50: 54 bytes on wire (432 bits), 54 bytes captured (432 bits) on interface 0
Ethernet II, Src: Parallel_53:32:ac (00:1c:42:53:32:ac), Dst: Parallel_00:00:18 (00:1c:42:00:00:18)
Internet Protocol Version 4, Src: 10.211.55.3 (10.211.55.3), Dst: 74.125.235.51 (74.125.235.51)
Transmission Control Protocol, Src Port: 43195 (43195), Dst Port: http (80), Seq: 374, Ack: 24949, Len: 0

No.     Time           Source                Destination           Protocol Length Info
     51 0.756964000    74.125.235.51         10.211.55.3           HTTP     1440   Continuation or non-HTTP traffic

Frame 51: 1440 bytes on wire (11520 bits), 1440 bytes captured (11520 bits) on interface 0
Ethernet II, Src: Parallel_00:00:18 (00:1c:42:00:00:18), Dst: Parallel_53:32:ac (00:1c:42:53:32:ac)
Internet Protocol Version 4, Src: 74.125.235.51 (74.125.235.51), Dst: 10.211.55.3 (10.211.55.3)
Transmission Control Protocol, Src Port: http (80), Dst Port: 43195 (43195), Seq: 24949, Ack: 374, Len: 1386
Hypertext Transfer Protocol

No.     Time           Source                Destination           Protocol Length Info
     52 1.226298000    10.211.55.3           74.125.235.51         HTTP     601    [TCP ACKed unseen segment] GET /images/icons/product/chrome-48.png HTTP/1.1 

Frame 52: 601 bytes on wire (4808 bits), 601 bytes captured (4808 bits) on interface 0
Ethernet II, Src: Parallel_53:32:ac (00:1c:42:53:32:ac), Dst: Parallel_00:00:18 (00:1c:42:00:00:18)
Internet Protocol Version 4, Src: 10.211.55.3 (10.211.55.3), Dst: 74.125.235.51 (74.125.235.51)
Transmission Control Protocol, Src Port: 43195 (43195), Dst Port: http (80), Seq: 374, Ack: 29927, Len: 547
Hypertext Transfer Protocol

No.     Time           Source                Destination           Protocol Length Info
     53 1.226482000    74.125.235.51         10.211.55.3           TCP      54     [TCP Previous segment not captured] http > 43195 [ACK] Seq=29927 Ack=921 Win=32768 Len=0

Frame 53: 54 bytes on wire (432 bits), 54 bytes captured (432 bits) on interface 0
Ethernet II, Src: Parallel_00:00:18 (00:1c:42:00:00:18), Dst: Parallel_53:32:ac (00:1c:42:53:32:ac)
Internet Protocol Version 4, Src: 74.125.235.51 (74.125.235.51), Dst: 10.211.55.3 (10.211.55.3)
Transmission Control Protocol, Src Port: http (80), Dst Port: 43195 (43195), Seq: 29927, Ack: 921, Len: 0

No.     Time           Source                Destination           Protocol Length Info
     54 1.227419000    10.211.55.3           74.125.235.51         TCP      74     43196 > http [SYN] Seq=0 Win=14600 Len=0 MSS=1460 SACK_PERM=1 TSval=310482 TSecr=0 WS=128

Frame 54: 74 bytes on wire (592 bits), 74 bytes captured (592 bits) on interface 0
Ethernet II, Src: Parallel_53:32:ac (00:1c:42:53:32:ac), Dst: Parallel_00:00:18 (00:1c:42:00:00:18)
Internet Protocol Version 4, Src: 10.211.55.3 (10.211.55.3), Dst: 74.125.235.51 (74.125.235.51)
Transmission Control Protocol, Src Port: 43196 (43196), Dst Port: http (80), Seq: 0, Len: 0

No.     Time           Source                Destination           Protocol Length Info
     55 1.227759000    10.211.55.3           74.125.235.51         TCP      74     43197 > http [SYN] Seq=0 Win=14600 Len=0 MSS=1460 SACK_PERM=1 TSval=310482 TSecr=0 WS=128

Frame 55: 74 bytes on wire (592 bits), 74 bytes captured (592 bits) on interface 0
Ethernet II, Src: Parallel_53:32:ac (00:1c:42:53:32:ac), Dst: Parallel_00:00:18 (00:1c:42:00:00:18)
Internet Protocol Version 4, Src: 10.211.55.3 (10.211.55.3), Dst: 74.125.235.51 (74.125.235.51)
Transmission Control Protocol, Src Port: 43197 (43197), Dst Port: http (80), Seq: 0, Len: 0

No.     Time           Source                Destination           Protocol Length Info
     56 1.488427000    74.125.235.51         10.211.55.3           TCP      1440   [TCP segment of a reassembled PDU]

Frame 56: 1440 bytes on wire (11520 bits), 1440 bytes captured (11520 bits) on interface 0
Ethernet II, Src: Parallel_00:00:18 (00:1c:42:00:00:18), Dst: Parallel_53:32:ac (00:1c:42:53:32:ac)
Internet Protocol Version 4, Src: 74.125.235.51 (74.125.235.51), Dst: 10.211.55.3 (10.211.55.3)
Transmission Control Protocol, Src Port: http (80), Dst Port: 43195 (43195), Seq: 29927, Ack: 921, Len: 1386

No.     Time           Source                Destination           Protocol Length Info
     57 1.488569000    74.125.235.51         10.211.55.3           HTTP     852    HTTP/1.1 200 OK  (PNG)

Frame 57: 852 bytes on wire (6816 bits), 852 bytes captured (6816 bits) on interface 0
Ethernet II, Src: Parallel_00:00:18 (00:1c:42:00:00:18), Dst: Parallel_53:32:ac (00:1c:42:53:32:ac)
Internet Protocol Version 4, Src: 74.125.235.51 (74.125.235.51), Dst: 10.211.55.3 (10.211.55.3)
Transmission Control Protocol, Src Port: http (80), Dst Port: 43195 (43195), Seq: 31313, Ack: 921, Len: 798
[2 Reassembled TCP Segments (2184 bytes): #56(1386), #57(798)]
Hypertext Transfer Protocol
Portable Network Graphics

No.     Time           Source                Destination           Protocol Length Info
     58 1.488647000    10.211.55.3           74.125.235.51         TCP      54     [TCP ACKed unseen segment] 43195 > http [ACK] Seq=921 Ack=32111 Win=42240 Len=0

Frame 58: 54 bytes on wire (432 bits), 54 bytes captured (432 bits) on interface 0
Ethernet II, Src: Parallel_53:32:ac (00:1c:42:53:32:ac), Dst: Parallel_00:00:18 (00:1c:42:00:00:18)
Internet Protocol Version 4, Src: 10.211.55.3 (10.211.55.3), Dst: 74.125.235.51 (74.125.235.51)
Transmission Control Protocol, Src Port: 43195 (43195), Dst Port: http (80), Seq: 921, Ack: 32111, Len: 0

No.     Time           Source                Destination           Protocol Length Info
     59 1.488828000    10.211.55.3           74.125.235.51         HTTP     589    GET /images/srpr/logo4w.png HTTP/1.1 

Frame 59: 589 bytes on wire (4712 bits), 589 bytes captured (4712 bits) on interface 0
Ethernet II, Src: Parallel_53:32:ac (00:1c:42:53:32:ac), Dst: Parallel_00:00:18 (00:1c:42:00:00:18)
Internet Protocol Version 4, Src: 10.211.55.3 (10.211.55.3), Dst: 74.125.235.51 (74.125.235.51)
Transmission Control Protocol, Src Port: 43195 (43195), Dst Port: http (80), Seq: 921, Ack: 32111, Len: 535
Hypertext Transfer Protocol

No.     Time           Source                Destination           Protocol Length Info
     60 1.489060000    74.125.235.51         10.211.55.3           TCP      54     http > 43195 [ACK] Seq=32111 Ack=1456 Win=32768 Len=0

Frame 60: 54 bytes on wire (432 bits), 54 bytes captured (432 bits) on interface 0
Ethernet II, Src: Parallel_00:00:18 (00:1c:42:00:00:18), Dst: Parallel_53:32:ac (00:1c:42:53:32:ac)
Internet Protocol Version 4, Src: 74.125.235.51 (74.125.235.51), Dst: 10.211.55.3 (10.211.55.3)
Transmission Control Protocol, Src Port: http (80), Dst Port: 43195 (43195), Seq: 32111, Ack: 1456, Len: 0

No.     Time           Source                Destination           Protocol Length Info
     61 1.490266000    10.211.55.3           74.125.235.51         TCP      74     43198 > http [SYN] Seq=0 Win=14600 Len=0 MSS=1460 SACK_PERM=1 TSval=310548 TSecr=0 WS=128

Frame 61: 74 bytes on wire (592 bits), 74 bytes captured (592 bits) on interface 0
Ethernet II, Src: Parallel_53:32:ac (00:1c:42:53:32:ac), Dst: Parallel_00:00:18 (00:1c:42:00:00:18)
Internet Protocol Version 4, Src: 10.211.55.3 (10.211.55.3), Dst: 74.125.235.51 (74.125.235.51)
Transmission Control Protocol, Src Port: 43198 (43198), Dst Port: http (80), Seq: 0, Len: 0

No.     Time           Source                Destination           Protocol Length Info
     62 1.490347000    10.211.55.3           74.125.235.51         TCP      74     43199 > http [SYN] Seq=0 Win=14600 Len=0 MSS=1460 SACK_PERM=1 TSval=310548 TSecr=0 WS=128

Frame 62: 74 bytes on wire (592 bits), 74 bytes captured (592 bits) on interface 0
Ethernet II, Src: Parallel_53:32:ac (00:1c:42:53:32:ac), Dst: Parallel_00:00:18 (00:1c:42:00:00:18)
Internet Protocol Version 4, Src: 10.211.55.3 (10.211.55.3), Dst: 74.125.235.51 (74.125.235.51)
Transmission Control Protocol, Src Port: 43199 (43199), Dst Port: http (80), Seq: 0, Len: 0

No.     Time           Source                Destination           Protocol Length Info
     63 1.490371000    10.211.55.3           74.125.235.51         TCP      74     43200 > http [SYN] Seq=0 Win=14600 Len=0 MSS=1460 SACK_PERM=1 TSval=310548 TSecr=0 WS=128

Frame 63: 74 bytes on wire (592 bits), 74 bytes captured (592 bits) on interface 0
Ethernet II, Src: Parallel_53:32:ac (00:1c:42:53:32:ac), Dst: Parallel_00:00:18 (00:1c:42:00:00:18)
Internet Protocol Version 4, Src: 10.211.55.3 (10.211.55.3), Dst: 74.125.235.51 (74.125.235.51)
Transmission Control Protocol, Src Port: 43200 (43200), Dst Port: http (80), Seq: 0, Len: 0

No.     Time           Source                Destination           Protocol Length Info
     64 1.491950000    74.125.235.51         10.211.55.3           TCP      62     http > 43197 [SYN, ACK] Seq=0 Ack=1 Win=32768 Len=0 MSS=1460 WS=2

Frame 64: 62 bytes on wire (496 bits), 62 bytes captured (496 bits) on interface 0
Ethernet II, Src: Parallel_00:00:18 (00:1c:42:00:00:18), Dst: Parallel_53:32:ac (00:1c:42:53:32:ac)
Internet Protocol Version 4, Src: 74.125.235.51 (74.125.235.51), Dst: 10.211.55.3 (10.211.55.3)
Transmission Control Protocol, Src Port: http (80), Dst Port: 43197 (43197), Seq: 0, Ack: 1, Len: 0

No.     Time           Source                Destination           Protocol Length Info
     65 1.491994000    10.211.55.3           74.125.235.51         TCP      54     43197 > http [ACK] Seq=1 Ack=1 Win=14720 Len=0

Frame 65: 54 bytes on wire (432 bits), 54 bytes captured (432 bits) on interface 0
Ethernet II, Src: Parallel_53:32:ac (00:1c:42:53:32:ac), Dst: Parallel_00:00:18 (00:1c:42:00:00:18)
Internet Protocol Version 4, Src: 10.211.55.3 (10.211.55.3), Dst: 74.125.235.51 (74.125.235.51)
Transmission Control Protocol, Src Port: 43197 (43197), Dst Port: http (80), Seq: 1, Ack: 1, Len: 0

No.     Time           Source                Destination           Protocol Length Info
